{
  "version": 1,
  "cohort_id": 1,
  "staker": "0x1111111111111111111111111111111111111111",
  "goal_hash": "0x3e5c02e53300b935e6edb8c6962e480928f0a50736085a4044ce1b23ff2e145b",
  "passed": true,
  "checks": [
    {
      "name": "repo_control",
      "passed": true,
      "detail": "nonce file found"
    },
    {
      "name": "commits_in_window",
      "passed": true,
      "detail": "3 of 2 commits first seen in window"
    },
    {
      "name": "substance",
      "passed": true,
      "detail": "adds a theme toggle component and wires it into the header"
    }
  ],
  "reasons": "The referee saw 3 new commits inside the window and they add the dark mode toggle.",
  "evidence": [
    {
      "kind": "github_commit",
      "ref": "a1b2c3d4e5f60718293a4b5c6d7e8f9012345678",
      "first_seen": "2026-10-11T22:41:12Z"
    },
    {
      "kind": "github_commit",
      "ref": "b2c3d4e5f60718293a4b5c6d7e8f901234567890",
      "first_seen": "2026-10-11T22:52:40Z"
    },
    {
      "kind": "github_commit",
      "ref": "c3d4e5f60718293a4b5c6d7e8f90123456789012",
      "first_seen": "2026-10-11T23:01:03Z"
    }
  ],
  "model_votes": [
    {
      "model": "model-a",
      "passed": true
    },
    {
      "model": "model-b",
      "passed": true
    }
  ],
  "human_override": false,
  "decided_at": "2026-10-11T23:05:30Z"
}
